{
  "protocolVersion": "1.0",
  "runId": "agentteams-local-runtime-001",
  "caseId": "CASE-2026-0042",
  "startedAt": "2026-08-14T02:32:46.834Z",
  "completedAt": "2026-08-14T02:33:06.896Z",
  "status": "passed",
  "boundary": "Local official AgentTeams v1.2.2 runtime with local Ollama qwen3:8b and fixture-backed DevOrbit tools. This is not a cloud account, vendor platform, or production-cluster run.",
  "runtime": {
    "team": {
      "name": "devorbit-delivery-team",
      "phase": "Active",
      "leaderReady": true,
      "readyWorkers": 7,
      "totalWorkers": 7
    },
    "workers": [
      {
        "name": "devorbit-lead",
        "phase": "Running",
        "model": "qwen3:8b",
        "runtime": "qwenpaw",
        "role": "team_leader"
      },
      {
        "name": "intake-worker",
        "phase": "Running",
        "model": "qwen3:8b",
        "runtime": "qwenpaw",
        "role": "worker"
      },
      {
        "name": "impact-worker",
        "phase": "Running",
        "model": "qwen3:8b",
        "runtime": "qwenpaw",
        "role": "worker"
      },
      {
        "name": "rca-worker",
        "phase": "Running",
        "model": "qwen3:8b",
        "runtime": "qwenpaw",
        "role": "worker"
      },
      {
        "name": "patch-worker",
        "phase": "Running",
        "model": "qwen3:8b",
        "runtime": "qwenpaw",
        "role": "worker"
      },
      {
        "name": "verify-worker",
        "phase": "Running",
        "model": "qwen3:8b",
        "runtime": "qwenpaw",
        "role": "worker"
      },
      {
        "name": "release-worker",
        "phase": "Running",
        "model": "qwen3:8b",
        "runtime": "qwenpaw",
        "role": "worker"
      },
      {
        "name": "learning-worker",
        "phase": "Running",
        "model": "qwen3:8b",
        "runtime": "qwenpaw",
        "role": "worker"
      }
    ],
    "matrix": {
      "adminId": "@devorbit-admin:matrix-local.agentteams.io:18080",
      "leaderId": "@devorbit-lead:matrix-local.agentteams.io:18080",
      "teamRoomId": "!FOy2kVzrLdT7MGyTfn:matrix-local.agentteams.io:18080",
      "leaderDmRoomId": "!7NadyxBWWERgbFJvfP:matrix-local.agentteams.io:18080",
      "roomCount": 10,
      "memberships": {
        "!7NadyxBWWERgbFJvfP:matrix-local.agentteams.io:18080": [
          "@devorbit-admin:matrix-local.agentteams.io:18080",
          "@devorbit-lead:matrix-local.agentteams.io:18080"
        ],
        "!FOy2kVzrLdT7MGyTfn:matrix-local.agentteams.io:18080": [
          "@devorbit-admin:matrix-local.agentteams.io:18080",
          "@devorbit-lead:matrix-local.agentteams.io:18080",
          "@impact-worker:matrix-local.agentteams.io:18080",
          "@intake-worker:matrix-local.agentteams.io:18080",
          "@learning-worker:matrix-local.agentteams.io:18080",
          "@patch-worker:matrix-local.agentteams.io:18080",
          "@rca-worker:matrix-local.agentteams.io:18080",
          "@release-worker:matrix-local.agentteams.io:18080",
          "@verify-worker:matrix-local.agentteams.io:18080"
        ],
        "!vlqkPGEgSh6QGMu4ZT:matrix-local.agentteams.io:18080": [
          "@devorbit-admin:matrix-local.agentteams.io:18080",
          "@devorbit-lead:matrix-local.agentteams.io:18080",
          "@manager:matrix-local.agentteams.io:18080"
        ],
        "!3WTNwVqget4GK07TTT:matrix-local.agentteams.io:18080": [
          "@devorbit-admin:matrix-local.agentteams.io:18080",
          "@intake-worker:matrix-local.agentteams.io:18080"
        ],
        "!TH2m6djOFH2lSlk7qw:matrix-local.agentteams.io:18080": [
          "@devorbit-admin:matrix-local.agentteams.io:18080",
          "@impact-worker:matrix-local.agentteams.io:18080"
        ],
        "!rQFuqOmxXtRdB6cqSz:matrix-local.agentteams.io:18080": [
          "@devorbit-admin:matrix-local.agentteams.io:18080",
          "@rca-worker:matrix-local.agentteams.io:18080"
        ],
        "!pAIgj8Fv34CVulVeGD:matrix-local.agentteams.io:18080": [
          "@devorbit-admin:matrix-local.agentteams.io:18080",
          "@patch-worker:matrix-local.agentteams.io:18080"
        ],
        "!imDDwbj3quOy6Pl2rm:matrix-local.agentteams.io:18080": [
          "@devorbit-admin:matrix-local.agentteams.io:18080",
          "@verify-worker:matrix-local.agentteams.io:18080"
        ],
        "!gJSmaUW8nvjzpvStEC:matrix-local.agentteams.io:18080": [
          "@devorbit-admin:matrix-local.agentteams.io:18080",
          "@release-worker:matrix-local.agentteams.io:18080"
        ],
        "!LqzjKa7eTFmaZISoN8:matrix-local.agentteams.io:18080": [
          "@devorbit-admin:matrix-local.agentteams.io:18080",
          "@learning-worker:matrix-local.agentteams.io:18080"
        ]
      }
    },
    "mcp": {
      "baselineOffset": 32,
      "protocolVersions": [
        "2025-06-18",
        "2025-11-25"
      ]
    }
  },
  "task": {
    "eventId": "$RBxkLAe8_Lwpzsof7YO5N9mo11QC87CRr4vwqh1P9l0",
    "completionMarker": "DEVORBIT_RUNTIME_RESULT",
    "timeoutSeconds": 900,
    "teamHarnessProjectId": "agentteams-local-runtime-001-mssc0xj8",
    "finalMessageId": "$QJCAl2nRFWlU_SWf6_mqbUngwBkfJXk8T_tjrKlm214"
  },
  "evidence": {
    "seenWorkers": [
      "impact-worker",
      "intake-worker",
      "learning-worker",
      "patch-worker",
      "rca-worker",
      "release-worker",
      "verify-worker"
    ],
    "requiredWorkers": [
      "intake-worker",
      "impact-worker",
      "rca-worker",
      "patch-worker",
      "verify-worker",
      "release-worker",
      "learning-worker"
    ],
    "auditChecks": [
      {
        "caller": "intake-worker",
        "tool": "issue.fetch_signals",
        "status": "ok",
        "observed": true
      },
      {
        "caller": "impact-worker",
        "tool": "repository.read_file",
        "status": "ok",
        "observed": true
      },
      {
        "caller": "rca-worker",
        "tool": "knowledge.search_cases",
        "status": "ok",
        "observed": true
      },
      {
        "caller": "patch-worker",
        "tool": "repository.create_workspace",
        "status": "ok",
        "observed": true
      },
      {
        "caller": "verify-worker",
        "tool": "ci.run_tests",
        "status": "ok",
        "observed": true
      },
      {
        "caller": "release-worker",
        "tool": "release.canary",
        "status": "denied",
        "observed": true
      },
      {
        "caller": "learning-worker",
        "tool": "knowledge.write_case",
        "status": "ok",
        "observed": true
      }
    ],
    "taskPlan": [
      {
        "id": "intake",
        "title": "Aggregate defect signals",
        "owner": "intake-worker",
        "dependsOn": [],
        "tools": [
          "issue.fetch_signals",
          "observability.fetch_signals"
        ],
        "instruction": "Fetch both issue and observability signals for CASE-2026-0042, preserve source IDs, and return a structured normalized signal summary with evidence references."
      },
      {
        "id": "impact",
        "title": "Map repository impact",
        "owner": "impact-worker",
        "dependsOn": [
          "intake"
        ],
        "tools": [
          "repository.read_file"
        ],
        "instruction": "Read src/redisPool.js and src/order.js from the approved fixture and report affected files, regression tests, digests, and evidence references."
      },
      {
        "id": "rca",
        "title": "Produce evidence-grounded RCA",
        "owner": "rca-worker",
        "dependsOn": [
          "impact"
        ],
        "tools": [
          "observability.fetch_signals",
          "knowledge.search_cases"
        ],
        "instruction": "Fetch observability signals for CASE-2026-0042 and search historical cases for redis pool timeout duplicate order. Return ranked root-cause hypotheses with direct evidence references."
      },
      {
        "id": "patch",
        "title": "Create minimal isolated patch",
        "owner": "patch-worker",
        "dependsOn": [
          "rca"
        ],
        "tools": [
          "repository.create_workspace",
          "repository.read_file",
          "ci.run_tests",
          "repository.write_file"
        ],
        "instruction": "Create workspace WS-CASE-2026-0042-AGENTTEAMS with idempotency key CASE-2026-0042:agentteams:workspace; read src/redisPool.js and src/order.js; run baseline tests; set redisPoolConfig to poolSize 80 and queueTimeoutMs 800; make createOrder return status 409 with the existing order for a duplicate idempotency key. Use stable per-write idempotency keys and return workspace, baseline test, patch, rollback, and evidence references."
      },
      {
        "id": "verify",
        "title": "Run regression quality gate",
        "owner": "verify-worker",
        "dependsOn": [
          "patch"
        ],
        "tools": [
          "ci.run_tests"
        ],
        "instruction": "Run tests in workspace WS-CASE-2026-0042-AGENTTEAMS with idempotency key CASE-2026-0042:agentteams:verify and return pass/fail counts, artifact, output summary, and evidence references."
      },
      {
        "id": "release",
        "title": "Verify L2 approval boundary",
        "owner": "release-worker",
        "dependsOn": [
          "verify"
        ],
        "tools": [
          "release.canary"
        ],
        "instruction": "Call release.canary for CASE-2026-0042, version devorbit-agentteams-0.7.0, approvalId APR-CASE-2026-0042, idempotency key CASE-2026-0042:agentteams:canary, and regressed false. Do not provide, invent, or bypass an approval token. Treat the expected policy denial as SUCCESS_WITH_NOTES and report terminal state needs_human with the denial evidence reference."
      },
      {
        "id": "learning",
        "title": "Persist safe terminal knowledge",
        "owner": "learning-worker",
        "dependsOn": [
          "release"
        ],
        "tools": [